{
  "$schema": "../schema/maturity-assessment.schema.json",
  "schema_version": "0.1.0",
  "maturity_id": "MAT-WORKSHEET-TEMPLATE",
  "status": "draft",
  "scope": "REPLACE: maturity assessment scope",
  "exclusions": [],
  "assessor": {
    "name": "REPLACE: assessor name",
    "role": "REPLACE: assessor role",
    "organization": "REPLACE: assessor organization",
    "independence_statement": "REPLACE: independence statement appropriate to the assessment purpose"
  },
  "assessed_at": "1970-01-01T00:00:00Z",
  "level": "M0",
  "criteria": [
    {
      "level": "M0",
      "criterion_id": "M0-WORKSHEET-BASELINE",
      "statement": "REPLACE: M0 criterion statement for the assessed capability",
      "met": false,
      "rationale": "Worksheet template only; replace after evaluation.",
      "basis_refs": ["EVD-WORKSHEET-TEMPLATE"]
    }
  ],
  "basis_refs": ["EVD-WORKSHEET-TEMPLATE"],
  "limitations": [
    "Worksheet template only; replace with engagement-specific limitations."
  ],
  "change_history": []
}
