{
  "$schema": "../schema/maturity-assessment.schema.json",
  "schema_version": "0.1.0",
  "maturity_id": "MAT-ENG3-API100",
  "status": "draft",
  "scope": "Fictional Summit Analytics API-100 gateway practice for CAP-140 during integrated engagement ENG-SA-2026-09-API100; no MOD-100 maturity is assessed.",
  "exclusions": [
    "Maturity of enterprise-wide gateway practice outside CAP-140.",
    "MOD-100 and any maturity roll-up across the integrated engagement."
  ],
  "assessor": {
    "name": "Morgan Ellis",
    "role": "Independent assessor",
    "organization": "Fictional Contour Assurance LLP",
    "independence_statement": "This fictional assessor is presented only to illustrate workbook recording structure."
  },
  "assessed_at": "2026-09-16T18:00:00Z",
  "level": "M1",
  "criteria": [
    {
      "level": "M0",
      "criterion_id": "M0-API100-BASELINE",
      "statement": "The fictional gateway current state is explicitly documented.",
      "met": true,
      "rationale": "The fictional gateway configuration documents routing and allowlist settings for CAP-140.",
      "basis_refs": [
        "EVD-ENG3-API100-GATEWAY",
        "ASR-ENG3-API100"
      ]
    },
    {
      "level": "M1",
      "criterion_id": "M1-API100-REPEATABLE",
      "statement": "The fictional gateway practice has accountable ownership and basic repeatable operation.",
      "met": true,
      "rationale": "The fictional package identifies platform owners and controlled revision metadata sufficient to illustrate M1 for workbook purposes.",
      "basis_refs": [
        "EVD-ENG3-API100-GATEWAY",
        "ASR-ENG3-API100"
      ]
    }
  ],
  "basis_refs": [
    "EVD-ENG3-API100-GATEWAY",
    "ASR-ENG3-API100"
  ],
  "limitations": [
    "This fictional draft maturity example does not assess an organization or establish any assurance outcome."
  ],
  "change_history": [
    {
      "version": "0.1.0-draft",
      "date": "2026-09-16T18:00:00Z",
      "author": "Morgan Ellis",
      "description": "Retained a separate, bounded fictional draft maturity assessment for API-100 within the integrated engagement."
    }
  ],
  "example_notice": "Fictional non-authoritative example; no organization, ESAF control, profile, or external framework has been assessed."
}
